name,category,qlib_expression,fields_used,price_basis,registry_status,formal_eligible,expected_sign,expected_decay_days,neutralization,rationale,source
mom_skip5d_120d,Momentum,"Ref(($close * $adj_factor), 6) / Ref(($close * $adj_factor), 121) - 1",$adj_factor;$close,adjusted,approved,yes,+,60,industry,Skip-last-week 120d momentum; reduces contamination from short-term reversal and T+1 crowding while using only approved OHLCV fields.,gpt_round3
risk_garman_klass_20d,Risk,"Mean(0.5 * Power(Log(Ref(($high * $adj_factor), 1) / Ref(($low * $adj_factor), 1)), 2) - 0.38629436112 * Power(Log(Ref(($close * $adj_factor), 1) / Ref(($open * $adj_factor), 1)), 2), 20)",$adj_factor;$close;$high;$low;$open,adjusted,approved,yes,-,20,industry,Garman-Klass OHLC volatility estimator; complements close-close vol and Parkinson log-range by using open-close information.,gpt_round3
rev_turnover_spike_5d,Reversal,"0 - ((Ref(($close * $adj_factor), 1) / Ref(($close * $adj_factor), 6) - 1) * (Mean(Ref($turnover_rate_f, 1), 5) / Mean(Ref($turnover_rate_f, 1), 60)))",$adj_factor;$close;$turnover_rate_f,adjusted,approved,yes,+,5,industry,Short-term reversal conditioned on free-float turnover spike; aims to capture retail/crowding overreaction with approved fields only.,gpt_round3
mom_continuous_info_252d_dir,Momentum,"Sign(Ref(($close * $adj_factor), 1) / Ref(($close * $adj_factor), 253) - 1) * Abs((Count((Ref(($close * $adj_factor), 1) / Ref(($close * $adj_factor), 2) - 1) > 0, 252) - Count((Ref(($close * $adj_factor), 1) / Ref(($close * $adj_factor), 2) - 1) < 0, 252)) / 252)",$adj_factor;$close,adjusted,approved,yes,+,60,industry,Directional information-discreteness fix: continuous winners rank high and continuous losers rank low; current merged row loses direction for continuous losers.,gpt_round3
qual_gross_profitability_ttm,Quality,"((Ref($total_revenue_sq_q0, 1) + Ref($total_revenue_sq_q1, 1) + Ref($total_revenue_sq_q2, 1) + Ref($total_revenue_sq_q3, 1)) - (Ref($oper_cost_sq_q0, 1) + Ref($oper_cost_sq_q1, 1) + Ref($oper_cost_sq_q2, 1) + Ref($oper_cost_sq_q3, 1))) / ((Ref($total_assets_q0, 1) + Ref($total_assets_q4, 1)) / 2)",$oper_cost_sq_q0;$oper_cost_sq_q1;$oper_cost_sq_q2;$oper_cost_sq_q3;$total_assets_q0;$total_assets_q4;$total_revenue_sq_q0;$total_revenue_sq_q1;$total_revenue_sq_q2;$total_revenue_sq_q3,raw,unknown_field,no,+,250,industry,TTM single-quarter gross profit over average assets; replaces cum_q0/end-assets variant that remains quarter-seasonal.,gpt_round3
margin_net_buy_ratio_20d_scaled,Margin,"Mean(Ref(($rzmre - $rzche), 1), 20) / (Ref($circ_mv, 1) * 10000)",$circ_mv;$rzche;$rzmre,raw,quarantine,no,+,20,industry,Unit-corrected margin net buy intensity: margin amounts are yuan while circ_mv is in 10k yuan.,gpt_round3
flow_elg_net_pct_20d_unitfix,Capital Flow,"Mean(Ref((($buy_elg_amount - $sell_elg_amount) / ($amount / 10)), 1), 20)",$amount;$buy_elg_amount;$sell_elg_amount,raw,quarantine,no,+,10,industry,Unit-corrected extra-large order net inflow: moneyflow amounts are in 10k yuan while daily amount is in thousand yuan.,gpt_round3
flow_inst_retail_divergence_20d_unitfix,Capital Flow,"Mean(Ref(((($buy_lg_amount + $buy_elg_amount - $sell_lg_amount - $sell_elg_amount) - ($buy_sm_amount - $sell_sm_amount)) / ($amount / 10)), 1), 20)",$amount;$buy_elg_amount;$buy_lg_amount;$buy_sm_amount;$sell_elg_amount;$sell_lg_amount;$sell_sm_amount,raw,quarantine,no,+,10,industry,Unit-corrected large/extra-large minus small-order divergence; keeps A-share retail-vs-institutional interaction but fixes amount scale.,gpt_round3
